spectral_community_id,spectral_community_size,total_holders,avg_holders,max_holders,avg_cohesion,modularity_contribution,dominant_collections
4,22,20231,919.5909090909091,2888,0.47747394116304687,0.007692474363402137,"Spikes, La Mouch, Legacy Eggs"
1,11,16492,1499.2727272727273,7515,0.2373840663872477,0.007692474363402137,"The10kSquad, Sealuminati Testnetooor, Meowwnads"
0,8,1625,203.125,426,0.19121404385706753,0.007692474363402137,"Lil Chogstars, Monadverse Genesis Hatch, The Daks Fantasies"
3,5,7229,1445.8,2792,0.09653271848924024,0.007692474363402137,"ROARRR, Molandaks, Purple Frens"
2,2,601,300.5,387,0.0,0.007692474363402137,"BUNS, Katana Pass"
5,1,19860,19860.0,19860,0.0,0.007692474363402137,Monadverse: Chapter 10
